ACCOUNT,EFF_DATE,SHORT_DESC,SMALL_NAME,DESCRIPTION,ACCOUNT_OWNER,GL_ACCOUNT,ACCOUNT_TYPE,SETID,STATUS,
53054,9/1/13,Awards Other,Awrds Othr,"Awards for non-employees which result from recognition of performance, achievement, service, etc.  Contact the Controller's Office for guidelines for the use of this account.",,Y,E,MDACC,A,
53100,1/1/01,Instit Develop Budget Only,InstDevBud,Account is used for budgeting purposes only and will not be available for recording actual transactional entries.,,Y,E,MDACC,A,
53101,1/1/01,Development Fund Raising,DevlpmtFnd,"Fundraising activities of the Institution which are responsible for soliciting donations from individuals, foundations, governments, and others which will strengthen MCACC across its missions. Fundraising activities include publicizing and conducting fundraising campaigns, maintaining donor mailing lists, conducting special fundraising events, preparing and distributing development materials, etc.",,Y,E,MDACC,A,
53102,1/1/01,Official Business Expenses,OfBusnssEx,Departmental courtesies (such as flowers) or business entertainment.  Please note that there are limits on the total cost and per person cost.  Contact the Controller's Office for guidelines.,,Y,E,MDACC,A,
53103,1/1/01,PRS Official Functions,PRS OfFunc,"Use restricted to Physician Referral Service - to record events that are over $2,500.",,Y,E,MDACC,A,
53501,1/1/01,Resale Childrens Art Project,Resale CAP,Merchandise that will be resold through an institutional outlet for Children's Art Project.,,Y,E,MDACC,A,
53502,1/2/01,Resale Gift Shop,ResaleGift,Merchandise that will be resold through an institutional outlet for Gift Shop.,,Y,E,MDACC,A,
53503,9/1/22,Resale Ecommerce,ResaEcomm,Resale Branded Merchandise-Ecommerce - The account is for branded merchandise that will be resold through an institutional Ecommerce website.,,Y,E,MDACC,A,
53505,1/1/01,Resale AFR Allocated Goods,Resale AFR,Allocation of goods for resale among the different AFR functions,,Y,E,MDACC,A,
54000,1/1/01,Purchased Services Budgt Check,PurSvcBdCk,Budget check accounts are restricted for Commitment Control processing.,,Y,E,MDACC,A,
54001,1/1/01,Srvcs Medical Rsch Budget Only,SrvMdRsBdg,Account is used for budgeting purposes only and will not be available for recording actual transactional entries.,,Y,E,MDACC,A,
54011,1/1/01,AFR Alloc Prof Contract Svcs,AFR Prof,Use restricted to Financial Reporting and only for AFR Ledger Group - Allocation of Professional and Contractual Services Expense among the different AFR functions,,Y,E,MDACC,A,
54012,1/1/01,AFR Alloc Other Contract Svcs,AFR Contr,Use restricted to Financial Reporting and only for AFR Ledger Group - Allocation of Other Contractual Services Expense among the different AFR functions,,Y,E,MDACC,A,
54013,1/1/01,AFR Alloc Other Expenses,AFR OthExp,Use restricted to Financial Reporting and only for AFR Ledger Group - Allocation of Other Operating Expense among the different AFR functions,,Y,E,MDACC,A,
54100,1/1/01,Participant Resrch Budget Only,ParRschBdg,Account is used for budgeting purposes only and will not be available for recording actual transactional entries.,,Y,E,MDACC,A,
54101,1/1/01,Prtcpnt Rsch Travel Reimb,RschTravel,Cost reimbursement of travel expense for participants of research studies.,,Y,E,MDACC,A,
54102,1/1/01,Prtcpnt Rsch Particpant Fee,RschPartFe,Fees paid to  participants of research studies.,,Y,E,MDACC,A,
54103,1/1/01,Prtcpnt Rsch CTRC Pharmacokntc,RschCTRCPk,Inter-departmental diagnostic and lab testing services.  Contact the General Accounting Department for guidelines. ,,Y,E,MDACC,A,
54111,1/1/01,Prtcpnt Rsch Pat Care F&A,RschPtntFA,Direct patient care charges for which a grant is paying the costs of patient care. The grant may pay for hotel costs for a patient while the patient is participating in a  study or the patient may be  paid an amount of money for participating in the study.,,Y,E,MDACC,A,
54112,1/1/01,Prtcpnt Rsch Pat Care noF&A,RschPtnoFA,Direct patient care charges for which a grant is paying the costs of patient care. The grant may pay for hotel costs for a patient while the patient is participating in a  study or the patient may be  paid an amount of money for participating in the study.,,Y,E,MDACC,A,
54120,9/1/13,Patient Protocol,PatProtoco,PBS protocol charge transfer,,Y,E,MDACC,A,
54300,1/1/01,Research Sub F&A Budget Only,SubF&ABdgt,Account is used for budgeting purposes only and will not be available for recording actual transactional entries.,,Y,E,MDACC,A,
54301,1/1/01,Private Pass Thru State Sub1,PrvPassSt1,Private grants and contracts referred to other state agencies for performance of the research.,,Y,E,MDACC,A,
54302,1/1/01,Private Pass Thru State Sub2,PrvPassSt2,Private grants and contracts referred to other state agencies for performance of the research.,,Y,E,MDACC,A,
54303,1/1/01,Private Pass Thru State Sub3,PrvPassSt3,Private grants and contracts referred to other state agencies for performance of the research.,,Y,E,MDACC,A,
54304,1/1/01,Private Pass Thru State Sub4,PrvPassSt4,Private grants and contracts referred to other state agencies for performance of the research.,,Y,E,MDACC,A,
54305,1/1/01,Private Pass Thru State Sub5,PrvPassSt5,Private grants and contracts referred to other state agencies for performance of the research.,,Y,E,MDACC,A,
54306,1/1/01,Private Pass Thru State Sub6,PrvPassSt6,Private grants and contracts referred to other state agencies for performance of the research.,,Y,E,MDACC,A,
54307,1/1/01,Private Pass Thru State Sub7,PrvPassSt7,Private grants and contracts referred to other state agencies for performance of the research.,,Y,E,MDACC,A,
54308,1/1/01,Private Pass Thru State Sub8,PrvPassSt8,Private grants and contracts referred to other state agencies for performance of the research.,,Y,E,MDACC,A,
54309,1/1/01,Private Pass Thru State Sub9,PrvPassSt9,Private grants and contracts referred to other state agencies for performance of the research.,,Y,E,MDACC,A,
54311,1/1/01,State Pass Through Expenditure,ST Pass Th,State grants and contracts referred to other state agencies for performance of the research.,,Y,E,MDACC,A,
54312,9/1/12,Private to Non State 1,P No St 1,Private grants subcontract to non State 1.,,Y,E,MDACC,A,
54313,9/1/12,Private to Non State 2,P No St 2,Private grants subcontract to non State 2.,,Y,E,MDACC,A,
54321,1/1/01,Fed Pass State Sub1 1st 25000,FedSt1 <25,"First $25,000 of Federal grants and contracts referred to other state agencies for performance of the research.",,Y,E,MDACC,A,
54322,1/1/01,Fed Pass State Sub2 1st 25000,FedSt2 <25,"First $25,000 of Federal grants and contracts referred to other state agencies for performance of the research.",,Y,E,MDACC,A,
54323,1/1/01,Fed Pass State Sub3 1st 25000,FedSt3 <25,"First $25,000 of Federal grants and contracts referred to other state agencies for performance of the research.",,Y,E,MDACC,A,
54324,1/1/01,Fed Pass State Sub4 1st 25000,FedSt4 <25,"First $25,000 of Federal grants and contracts referred to other state agencies for performance of the research.",,Y,E,MDACC,A,
54325,1/1/01,Fed Pass State Sub5 1st 25000,FedSt5 <25,"First $25,000 of Federal grants and contracts referred to other state agencies for performance of the research.",,Y,E,MDACC,A,
54326,1/1/01,Fed Pass State Sub6 1st 25000,FedSt6 <25,"First $25,000 of Federal grants and contracts referred to other state agencies for performance of the research.",,Y,E,MDACC,A,
54327,1/1/01,Fed Pass State Sub7 1st 25000,FedSt7 <25,"First $25,000 of Federal grants and contracts referred to other state agencies for performance of the research.",,Y,E,MDACC,A,
54328,1/1/01,Fed Pass State Sub8 1st 25000,FedSt8 <25,"First $25,000 of Federal grants and contracts referred to other state agencies for performance of the research.",,Y,E,MDACC,A,
54329,1/1/01,Fed Pass State Sub9 1st 25000,FedSt9 <25,"First $25,000 of Federal grants and contracts referred to other state agencies for performance of the research.",,Y,E,MDACC,A,
54341,1/1/01,Fed Pass Thru Sub1 1st 25000,FedPss1<25,"First $25,000 of any payment to a sub-contractor who is performing a portion of the work on a  grant or contract at another institution.",,Y,E,MDACC,A,
54342,1/1/01,Fed Pass Thru Sub2 1st 25000,FedPss2<25,"First $25,000 of any payment to a sub-contractor who is performing a portion of the work on a  grant or contract at another institution.",,Y,E,MDACC,A,
54343,1/1/01,Fed Pass Thru Sub3 1st 25000,FedPss3<25,"First $25,000 of any payment to a sub-contractor who is performing a portion of the work on a  grant or contract at another institution.",,Y,E,MDACC,A,
54344,1/1/01,Fed Pass Thru Sub4 1st 25000,FedPss4<25,"First $25,000 of any payment to a sub-contractor who is performing a portion of the work on a  grant or contract at another institution.",,Y,E,MDACC,A,
54345,1/1/01,Fed Pass Thru Sub5 1st 25000,FedPss5<25,"First $25,000 of any payment to a sub-contractor who is performing a portion of the work on a  grant or contract at another institution.",,Y,E,MDACC,A,
54346,1/1/01,Fed Pass Thru Sub6 1st 25000,FedPss6<25,"First $25,000 of any payment to a sub-contractor who is performing a portion of the work on a  grant or contract at another institution.",,Y,E,MDACC,A,
54347,1/1/01,Fed Pass Thru Sub7 1st 25000,FedPss7<25,"First $25,000 of any payment to a sub-contractor who is performing a portion of the work on a  grant or contract at another institution.",,Y,E,MDACC,A,
54348,1/1/01,Fed Pass Thru Sub8 1st 25000,FedPss8<25,"First $25,000 of any payment to a sub-contractor who is performing a portion of the work on a  grant or contract at another institution.",,Y,E,MDACC,A,
54349,1/1/01,Fed Pass Thru Sub9 1st 25000,FedPss9<25,"First $25,000 of any payment to a sub-contractor who is performing a portion of the work on a  grant or contract at another institution.",,Y,E,MDACC,A,
54351,9/1/12,State Pass-Thru 1 - Overhead,St Pass 1,"State Grants and Contracts passed through to Non TX State Institutions, subject to overhead",,Y,E,MDACC,A,
54352,9/1/12,State Pass-Thru 2 - Overhead,St Pass 2,"State Grants and Contracts passed through to Non TX State Institutions, subject to overhead",,Y,E,MDACC,A,
54353,9/1/12,State Pass-Thru 3 - Overhead,St Pass 3,"State Grants and Contracts passed through to Non TX State Institutions, subject to overhead",,Y,E,MDACC,A,
54354,9/1/12,State Pass-Thru 4 - Overhead,St Pass 4,"State Grants and Contracts passed through to Non TX State Institutions, subject to overhead",,Y,E,MDACC,A,
54355,9/1/12,State Pass-Thru 5 - Overhead,St Pass 5,"State Grants and Contracts passed through to Non TX State Institutions, subject to overhead",,Y,E,MDACC,A,
54361,9/1/12,St Pass-Thru To St 1- Overhead,St Pass 1,"State Grants and Contracts passed through to Other TX State Agencies, subject to overhead",,Y,E,MDACC,A,
54362,9/1/12,S Pass-Thru To St 2- Overhead,St Pass 2,"State Grants and Contracts passed through to Other TX State Agencies, subject to overhead",,Y,E,MDACC,A,
54363,9/1/12,St Pass-Thru To St 3- Overhead,St Pass 3,"State Grants and Contracts passed through to Other TX State Agencies, subject to overhead",,Y,E,MDACC,A,
54364,9/1/12,St Pass-Thru To St - Overhead,St Pass 4,State Grants and Contracts passed through to Other TX State Agencies subject to overhead.,,Y,E,MDACC,A,
54365,9/1/12,S Pass-Thru To St 5- Overhead,St Pass 5,State Grants and Contracts passed through to Other TX State Agencies subject to overhead.,,Y,E,MDACC,A,
54400,1/1/01,Research Sub NonF&A Budgt Only,SbNoF&ABdg,Account is used for budgeting purposes only.,,Y,E,MDACC,A,
54421,1/1/01,Fed Pass State Sub1 Grtr 25000,FedSt1 >25,Federal grants and contracts referred to other state agencies for performance of the research.,,Y,E,MDACC,A,
54422,1/1/01,Fed Pass State Sub2 Grtr 25000,FedSt2 >25,Federal grants and contracts referred to other state agencies for performance of the research.,,Y,E,MDACC,A,
54423,1/1/01,Fed Pass State Sub3 Grtr 25000,FedSt3 >25,Federal grants and contracts referred to other state agencies for performance of the research.,,Y,E,MDACC,A,
54424,1/1/01,Fed Pass State Sub4 Grtr 25000,FedSt4 >25,Federal grants and contracts referred to other state agencies for performance of the research.,,Y,E,MDACC,A,
54425,1/1/01,Fed Pass State Sub5 Grtr 25000,FedSt5 >25,Federal grants and contracts referred to other state agencies for performance of the research.,,Y,E,MDACC,A,
54426,1/1/01,Fed Pass State Sub6 Grtr 25000,FedSt6 >25,Federal grants and contracts referred to other state agencies for performance of the research.,,Y,E,MDACC,A,
54427,1/1/01,Fed Pass State Sub7 Grtr 25000,FedSt7 >25,Federal grants and contracts referred to other state agencies for performance of the research.,,Y,E,MDACC,A,
54428,1/1/01,Fed Pass State Sub8 Grtr 25000,FedSt8 >25,Federal grants and contracts referred to other state agencies for performance of the research.,,Y,E,MDACC,A,
54429,1/1/01,Fed Pass State Sub9 Grtr 25000,FedSt9 >25,Federal grants and contracts referred to other state agencies for performance of the research.,,Y,E,MDACC,A,
54441,1/1/01,Fed Pass Thru Sub1 Grtr 25000,FedPss1>25,Payment to a sub-contractor who is performing a portion of the work on a  grant or contract at another institution.,,Y,E,MDACC,A,
54442,1/1/01,Fed Pass Thru Sub2 Grtr 25000,FedPss2>25,Payment to a sub-contractor who is performing a portion of the work on a  grant or contract at another institution.,,Y,E,MDACC,A,
54443,1/1/01,Fed Pass Thru Sub3 Grtr 25000,FedPss3>25,Payment to a sub-contractor who is performing a portion of the work on a  grant or contract at another institution.,,Y,E,MDACC,A,
54444,1/1/01,Fed Pass Thru Sub4 Grtr 25000,FedPss4>25,Payment to a sub-contractor who is performing a portion of the work on a  grant or contract at another institution.,,Y,E,MDACC,A,
54445,1/1/01,Fed Pass Thru Sub5 Grtr 25000,FedPss5>25,Payment to a sub-contractor who is performing a portion of the work on a  grant or contract at another institution.,,Y,E,MDACC,A,
54446,1/1/01,Fed Pass Thru Sub6 Grtr 25000,FedPss6>25,Payment to a sub-contractor who is performing a portion of the work on a  grant or contract at another institution.,,Y,E,MDACC,A,
54447,1/1/01,Fed Pass Thru Sub7 Grtr 25000,FedPss7>25,Payment to a sub-contractor who is performing a portion of the work on a  grant or contract at another institution.,,Y,E,MDACC,A,
54448,1/1/01,Fed Pass Thru Sub8 Grtr 25000,FedPss8>25,Payment to a sub-contractor who is performing a portion of the work on a  grant or contract at another institution.,,Y,E,MDACC,A,
54449,1/1/01,Fed Pass Thru Sub9 Grtr 25000,FedPss9>25,Payment to a sub-contractor who is performing a portion of the work on a  grant or contract at another institution.,,Y,E,MDACC,A,
54451,9/1/12,State Pass-Thru 1- No Overhead,St Pass 1,"State Grants and Contracts passed through to Non TX State Institutions, not subject to overhead",,Y,E,MDACC,A,
54452,9/1/12,State Pass-Thru 2- No Overhead,St Pass 2,"State Grants and Contracts passed through to Non TX State Institutions, not subject to overhead",,Y,E,MDACC,A,
54453,9/1/12,State Pass-Thru 3- No Overhead,St Pass 3,"State Grants and Contracts passed through to Non TX State Institutions, not subject to overhead",,Y,E,MDACC,A,
54454,9/1/12,State Pass-Thru 4- No Overhead,St Pass 4,"State Grants and Contracts passed through to Non TX State Institutions, not subject to overhead",,Y,E,MDACC,A,
54455,9/1/12,State Pass-Thru 5- No Overhead,St Pass 5,"State Grants and Contracts passed through to Non TX State Institutions, not subject to overhead",,Y,E,MDACC,A,
54461,9/1/12,St Pass-Thru To St 1- No Ovrhd,St Pass 1,"State Grants and Contracts passed through to Other TX State Agencies, not subject to overhead",,Y,E,MDACC,A,
54462,9/1/12,St Pass-Thru To St 2- No Ovrhd,St Pass 2,"State Grants and Contracts passed through to Other TX State Agencies, not subject to overhead",,Y,E,MDACC,A,
54463,9/1/12,St Pass-Thru To St 3- No Ovrhd,St Pass 3,"State Grants and Contracts passed through to Other TX State Agencies, not subject to overhead",,Y,E,MDACC,A,
54464,9/1/12,St Pass-Thru To St 4- No Ovrhd,St Pass 4,"State Grants and Contracts passed through to Other TX State Agencies, not subject to overhead",,Y,E,MDACC,A,
54465,9/1/12,St Pass-Thru To St 5- No Ovrhd,St Pass 5,"State Grants and Contracts passed through to Other TX State Agencies, not subject to overhead",,Y,E,MDACC,A,
55000,1/1/01,Services Other Budget Only,SrvcOthBud,Account is used for budgeting purposes only and will not be available for recording actual transactional entries.,,Y,E,MDACC,A,
55001,1/1/01,Advertising Recruitment,AdvRecruit,"Advertising such as radio, television, newspaper, printed materials, etc to recruit potential employees.",,Y,E,MDACC,A,
55002,1/1/01,Advertising Marketing,AdvMarktg,"Advertising such as radio, television, newspaper, printed materials, etc. to promote MDACC.",,Y,E,MDACC,A,
55003,9/1/19,Architectural/Engineering Svc,ArchEngSvc,"Architectural or Engineering  services rendered on a fee, contract, or other basis by a person, firm, corporation, or company recognized as possessing a high degree of learning and responsibility.",,Y,E,MDACC,A,
55004,1/1/01,Auditing Fees,Audit Fee,"Services rendered on a fee, contract, or other basis by an auditing firm.",,Y,E,MDACC,A,
55006,1/1/01,Catering,Catering,"Services rendered on a fee, contract, or other basis related to cater food.",,Y,E,MDACC,A,
55007,1/1/01,Childcare,Childcare,"Services rendered on a fee, contract, or other basis to provide child care.",,Y,E,MDACC,A,
55008,1/1/01,Conference Reg Fees & Svcs,ConfRegSvc,Registration fees and training expenses incurred by state employees for seminars and conferences.,,Y,E,MDACC,A,
55009,9/1/23,Professional Fees and Services,ProfFeeSvc,"Professional fees related to services provided.  This includes financial, medical and consulting related fees.  Example are design architectural fee, IT project-related work, business process/remediation work, etc.",,Y,E,MDACC,A,
55010,9/1/13,Clinical Reference Lab Testing,C Ref Lab,Testing cost of patient specimens performed by an outside reference laboratory - Patient chargeable. ,,Y,E,MDACC,A,
55011,1/1/01,Compliance Testing,ComplnTest,The cost to perform compliance testing.,,Y,E,MDACC,A,
55012,9/1/19,Facilities Services,FacilSvcs,Facilities purchases made to outside vendors for non-maintenance/repair services rendered.,,Y,E,MDACC,A,
55013,9/1/17,Freight/Delivery/Courier Svs,FrghtDelvy,Separate billing for freight when freight is not included on the original goods invoice associated to the freight bill.,,Y,E,MDACC,A,
55014,1/1/01,Janitorial Custodial Services,JanitorSvc,The cost of providing janitorial services.,,Y,E,MDACC,A,
55015,1/1/01,Lab and Animal Maint Services,LabAnmlMnt,"Diagnostic, radiology, and lab testing services.",,Y,E,MDACC,A,
55016,1/1/01,Laundry Services,Laundry,"Laundry services rendered on a fee, contract, or other basis by a person, firm, corporation, or company recognized as possessing a high degree of responsibility.",,Y,E,MDACC,A,
55017,1/1/01,Legal Fees,Legal Fees,Legal counsel services.,,Y,E,MDACC,A,
55018,9/2/19,Financial/Medical Services,Fin/MedSvc,Financial or medical related professional services.,,Y,E,MDACC,A,
55019,9/2/17,Professional Consulting Srvs,ProfConsSv,"Consulting services rendered on a fee, contract, or other basis by a person, firm, corporation, or company recognized as possessing a high degree of knowledge within a specialty area.  Examples are IT project-related work, business process/remediation work, etc.  A Consulting Authorization Justification (CAJ) form must be initially executed through Sourcing & Contract Management.",,Y,E,MDACC,A,
55020,9/1/19,SaaS & Cloud Computing,SaaSCC,"Costs associated with the use of an Application Service Providers (ASP) provided or hosted, Software-as-a-Service (SaaS), or for externally hosted Cloud computing application.",,Y,E,MDACC,A,
55021,1/1/01,Management Fees and Services,MgmtFeeSvc,"Management services rendered on a fee, contract, or other basis by a person, firm, corporation, or company recognized as possessing a high degree of responsibility.",,Y,E,MDACC,A,
55022,9/1/21,PRS RBP Pension Expense,PRSRBPPen,Pension Expense PRS Retirement Benefit Plan related  to GASB 97 Pension.,,Y,E,MDACC,A,
55023,9/1/22,PRS Prof Serv Agreements (PSA),ProfCarSer,PRS Professional Services Agreements (PSA).  Professional Care Services.,,Y,E,MDACC,A,
55025,1/1/01,Parking Employ Outside Vendors,Parking,Parking expenditures other than those incurred during employee travel.,,Y,E,MDACC,A,
55026,1/1/01,Parking Valet,Park Valet,Valet parking expenditures other than those incurred during employee travel.,,Y,E,MDACC,A,
55028,1/1/01,Postal Services,PostalSvcs,"Postal services, including post office box rentals.",,Y,E,MDACC,A,
55029,1/1/01,Printing and Publishing,PrintPblsh,"Expenses related to pamphlets, medical journals, or other published material.",,Y,E,MDACC,A,
55030,1/1/01,AFR Alloc Printing & Reprod,AFR Print,Use restricted to Financial Reporting and only for AFR Ledger Group - Allocation of printing expense among the different AFR functions,,Y,E,MDACC,A,
55035,1/1/01,Records Mgmt and Disposal,RecordMgmt,Storage and retrieval of institutional records from the warehouse.,,Y,E,MDACC,A,
55036,1/1/01,Recruitment and Relocation,RecruitRel,Payments made to commercial moving companies for the moving of state employees' household goods and other personal items.  Contact Human Resources Dept for guidelines.,,Y,E,MDACC,A,
55037,1/1/01,Royalty Payments,RoyaltyPay,"A payment made for the use of property, especially a patent.",,Y,E,MDACC,A,
55038,1/1/01,Fees - Other,FeesOther,Cover all other fees that are not specifically assigned by other expense accounts.,,Y,E,MDACC,A,
55041,9/1/22,Staff Augmentation,Staff Aug,Staff augmentation are services delivered by an outside agency or independent contractor to provide supplemental staffing for job positions and/or services currently being provided by the institution for a designated period of time.,,Y,E,MDACC,A,
55042,1/1/01,Transcription,Transcrptn,"Transcription services rendered on a fee, contract, or other basis by a person, firm, corporation, or company recognized as possessing a high degree of responsibility.",,Y,E,MDACC,A,
55043,1/1/01,Uniform Services,UniformSvc,The cost of providing uniform services.,,Y,E,MDACC,A,
55044,1/1/01,Environmental Services,EnvrnmntSv,The cost of maintaining environmental services.,,Y,E,MDACC,A,
55060,1/1/01,Membership Due Lic GC BudOnly,MemDueBdCk,Budget check for membership dues and licenses expenses.,,Y,E,MDACC,A,
55061,1/1/01,Membership Dues and Licenses,FeeMembDue,Membership dues for professional societies and organizations and license renewal fees for professional licensing.,,Y,E,MDACC,A,
55062,1/1/01,Membership Due License Medical,MembDueMed,Membership dues for medical societies and organizations and license renewal fees for medical licensing.,,Y,E,MDACC,A,
55101,1/1/01,IDS Animal Maintenance Service,IDSAnmalMt,Inter-departmental payment for the healthcare and daily maintenance of animals. Contact General Accounting Dept for guidelines. ,,Y,E,MDACC,A,
55102,1/1/01,IDS Lab Services,IDS LabSvc,Inter-departmental diagnostic and lab testing services.  Contact General Accounting Dept for guidelines. ,,Y,E,MDACC,A,
55103,1/1/01,IDS Other Purchased Services,IDS OthSvc,Inter-departmental services other than for animal maintenance and lab services. Contact General Accounting Dept for guidelines.,,Y,E,MDACC,A,
55104,9/1/18,IDS PI Core Services,IDSPICore,Inter-departmental services PI Core Services. Contact General Accounting Dept for guidelines.,,Y,E,MDACC,A,
55105,9/1/18,IDS Admin Core Services,IDSAdmCore,Inter-departmental services Admin Core Services. Contact General Accounting Dept for guidelines.,,Y,E,MDACC,A,
55106,9/1/18,IDS CRS Core Services,IDSCRSCore,Inter-departmental services CRS Core Services. Contact General Accounting Dept for guidelines.,,Y,E,MDACC,A,
55201,1/1/01,MedSvc Contract PhysicianUTHSC,MdSv UTHSC,"Medical services such as by a physician, dentist, nurse, physical therapist, diagnostic and analytical laboratory, ambulance service, etc. rendered on a contract basis by physicians at UT Health Science Center in Houston.",,Y,E,MDACC,A,
55203,1/1/01,MedSvc Marrow Donor Services,MdSvMarrow,Medical services related to marrow donor program.,,Y,E,MDACC,A,
55205,1/1/01,MedSvc Physicians Network,MdSvPhyNtw,Medical services rendered on a contract basis by Physicians Network.,,Y,E,MDACC,A,
55207,1/1/01,MedSvc Rotating Residences,MdSvRotRes,Salary expenses of rotating residents .,,Y,E,MDACC,A,
55209,1/1/01,MedSvc Services Corp,MdSvServCp,Medical services rendered on a contract basis by Services Corp.,,Y,E,MDACC,A,
55210,9/1/16,Tissue Sample,TissueSamp,Tissue samples that are purchased through the new single pay vendor process.,,Y,E,MDACC,A,
55301,1/1/01,Insur Institutional Premium,InsInsttnl,"Insurance premiums paid for buildings, vehicles, equipment, etc.  See 5204221 for employee health insurance premiums.",,Y,E,MDACC,A,
55303,1/1/01,Insur Professional Liab Prem,InsProfLia,Insurance premiums paid for malpractice and other professional liabilities.,,Y,E,MDACC,A,
55401,1/1/01,Bank Fees,Bank Fees,Transaction fees charged by banks or credit card companies.,,Y,E,MDACC,A,
55403,1/1/01,Collection Agency Fees,CollectAgy,Fees charged by outside collection agencies.,,Y,E,MDACC,A,
55411,9/1/12,Fees Fr Industry Fund Grnts-FA,Fees-FA,"Use restricted to GRANTS only - Expense on grants for private industry contracts that allow institutional fees, IRB, pharmacy, etc.  Included Facilities and Admin (indirect cost).",,Y,E,MDACC,A,
55412,9/1/12,Fees Fr Indust Fund Grnt-No FA,Fees-NO FA,"Use restricted to GRANTS only - Expense on grants for private industry contracts that allow institutional fees, IRB, pharmacy, etc.  Not Included Facilities and Admin (indirect cost).",,Y,E,MDACC,A,
